[
  {
    "Title": "'T HOF VAN COMMERCE + GIJS — 30-01-2026",
    "DateString": "2026-01-30T20:00:00+01:00",
    "Url": "https://www.n9.be/agenda/5117-t-hof-van-commerce/",
    "ImageUrl": "https://www.n9.be/media/event-large/1484-111569795thofvancommerce.jpg",
    "Location": "muziekclub N9",
    "Description": ""
  },
  {
    "Title": "SHEHERAZAAD — 31-01-2026",
    "DateString": "2026-01-31T20:00:00+01:00",
    "Url": "https://www.n9.be/agenda/242-sheherazaad/",
    "ImageUrl": "https://www.n9.be/media/event-large/1051-111502092sheherazaad.jpg",
    "Location": "CC Evergem",
    "Description": ""
  },
  {
    "Title": "STÉPHANE GALLAND: KANDA + KIN GAJO — 07-02-2026",
    "DateString": "2026-02-07T20:00:00+01:00",
    "Url": "https://www.n9.be/agenda/5128-stephane-galland-kanda/",
    "ImageUrl": "https://www.n9.be/media/event-large/2803-111511219stephanegallandkandakingajo.jpg",
    "Location": "muziekclub N9",
    "Description": ""
  },
  {
    "Title": "ZU + STAHLMUS DELEGATION — 10-02-2026",
    "DateString": "2026-02-10T20:00:00+01:00",
    "Url": "https://www.n9.be/agenda/5123-zu/",
    "ImageUrl": "https://www.n9.be/media/event-large/1797-111570418zu.jpg",
    "Location": "muziekclub N9",
    "Description": ""
  },
  {
    "Title": "JAMZ.BOND — 12-02-2026",
    "DateString": "2026-02-12T19:00:00+01:00",
    "Url": "https://www.n9.be/agenda/5149-jamz.bond/",
    "ImageUrl": "https://www.n9.be/media/event-large/2797-111571090jamz.bond.jpg",
    "Location": "N9 fabriek",
    "Description": ""
  },
  {
    "Title": "DE DOLFIJNTJES — 14-02-2026",
    "DateString": "2026-02-14T20:00:00+01:00",
    "Url": "https://www.n9.be/agenda/5124-de-dolfijntjes/",
    "ImageUrl": "https://www.n9.be/media/event-large/1800-111541140dedolfijntjes.jpg",
    "Location": "muziekclub N9",
    "Description": ""
  },
  {
    "Title": "20 JAAR NOTMB: MEMORIAM, RECTAL SMEGMA, SERIAL BUTCHER, TOXIC SHOCK, LOATHSOME, SPEARHEAD — 21-02-2026",
    "DateString": "2026-02-21T18:00:00+01:00",
    "Url": "https://www.n9.be/agenda/5126-20-jaar-notmb-memoriam-rectal-smegma-serial-butcher-toxic-shock-loathsome-spearhead/",
    "ImageUrl": "https://www.n9.be/media/event-large/1817-11153997720jaarnotmbmemoriamrectalsmegmaserialbutchertoxicshockloathsomespearhead.jpg",
    "Location": "muziekclub N9",
    "Description": ""
  },
  {
    "Title": "STUDIO VS. LIVE — 25-02-2026",
    "DateString": "2026-02-25T19:00:00+01:00",
    "Url": "https://www.n9.be/agenda/5134-studio-vs.-live/",
    "ImageUrl": "https://www.n9.be/media/event-large/2081-111595553studiovs.live.jpg",
    "Location": "muziekclub N9",
    "Description": ""
  },
  {
    "Title": "ÃO — 27-02-2026",
    "DateString": "2026-02-27T20:00:00+01:00",
    "Url": "https://www.n9.be/agenda/5146-ao/",
    "ImageUrl": "https://www.n9.be/media/event-large/2559-111546000ao.jpg",
    "Location": "muziekclub N9",
    "Description": ""
  },
  {
    "Title": "WORKSHOP FUZZ FACE — 04-03-2026",
    "DateString": "2026-03-04T19:30:00+01:00",
    "Url": "https://www.n9.be/agenda/5144-workshop-fuzz-face/",
    "ImageUrl": "https://www.n9.be/media/event-large/2553-111594182workshopfuzzface.jpg",
    "Location": "muziekclub N9",
    "Description": ""
  },
  {
    "Title": "FLYING HORSEMAN — 06-03-2026",
    "DateString": "2026-03-06T20:00:00+01:00",
    "Url": "https://www.n9.be/agenda/5142-flying-horseman/",
    "ImageUrl": "https://www.n9.be/media/event-large/2497-111604272flyinghorseman.jpg",
    "Location": "muziekclub N9",
    "Description": ""
  },
  {
    "Title": "KID CONGO & THE PINK MONKEY BIRDS + LIZ LAMERE — 10-03-2026",
    "DateString": "2026-03-10T20:00:00+01:00",
    "Url": "https://www.n9.be/agenda/5131-kid-congo-the-pink-monkey-birds/",
    "ImageUrl": "https://www.n9.be/media/event-large/2071-111580430kidcongothepinkmonkeybirds.jpg",
    "Location": "muziekclub N9",
    "Description": ""
  },
  {
    "Title": "CALI AGENTS — 18-03-2026",
    "DateString": "2026-03-18T20:00:00+01:00",
    "Url": "https://www.n9.be/agenda/5148-cali-agents/",
    "ImageUrl": "https://www.n9.be/media/event-large/2567-111616980caliagents.jpg",
    "Location": "muziekclub N9",
    "Description": ""
  },
  {
    "Title": "DE MUZIEKINDUSTRIE VOOR BEGINNERS EN GEVORDERDEN — 25-03-2026",
    "DateString": "2026-03-25T19:30:00+01:00",
    "Url": "https://www.n9.be/agenda/5137-de-muziekindustrie-voor-beginners-en-gevorderden/",
    "ImageUrl": "https://www.n9.be/media/event-large/2306-111598312demuziekindustrievoorbeginnersengevorderden.jpg",
    "Location": "N9 fabriek",
    "Description": ""
  },
  {
    "Title": "GA-20  — 27-03-2026",
    "DateString": "2026-03-27T20:00:00+01:00",
    "Url": "https://www.n9.be/agenda/5127-ga20/",
    "ImageUrl": "https://www.n9.be/media/event-large/1822-111580429ga20.jpg",
    "Location": "muziekclub N9",
    "Description": ""
  },
  {
    "Title": "WORKSHOP ECHOBENDER — 22-04-2026",
    "DateString": "2026-04-22T19:00:00+02:00",
    "Url": "https://www.n9.be/agenda/5145-workshop-echobender/",
    "ImageUrl": "https://www.n9.be/media/event-large/2554-111594188workshopechobender.jpg",
    "Location": "N9 fabriek",
    "Description": ""
  },
  {
    "Title": "STEVE GUNN — 25-04-2026",
    "DateString": "2026-04-25T20:00:00+02:00",
    "Url": "https://www.n9.be/agenda/5141-steve-gunn/",
    "ImageUrl": "https://www.n9.be/media/event-large/2495-111600178stevegunn.jpg",
    "Location": "N9 fabriek",
    "Description": ""
  },
  {
    "Title": "THE BEVIS FROND — 01-05-2026",
    "DateString": "2026-05-01T20:00:00+02:00",
    "Url": "https://www.n9.be/agenda/5130-the-bevis-frond/",
    "ImageUrl": "https://www.n9.be/media/event-large/2063-111573557thebevisfrond.jpg",
    "Location": "muziekclub N9",
    "Description": ""
  },
  {
    "Title": "DEN DER HALE + GOLDEN HOURS — 08-05-2026",
    "DateString": "2026-05-08T20:00:00+02:00",
    "Url": "https://www.n9.be/agenda/5138-den-der-hale-golden-hours/",
    "ImageUrl": "https://www.n9.be/media/event-large/2482-111571105denderhalegoldenhours.jpg",
    "Location": "muziekclub N9",
    "Description": ""
  },
  {
    "Title": "MATTIAS DE CRAENE & BLACK KOYO — 30-05-2026",
    "DateString": "2026-05-30T20:00:00+02:00",
    "Url": "https://www.n9.be/agenda/5129-mattias-de-craene-black-koyo/",
    "ImageUrl": "https://www.n9.be/media/event-large/2054-111511222mattiasdecraeneblackkoyo.jpg",
    "Location": "muziekclub N9",
    "Description": ""
  },
  {
    "Title": "SCHNTZL — 05-06-2026",
    "DateString": "2026-06-05T20:00:00+02:00",
    "Url": "https://www.n9.be/agenda/5136-schntzl/",
    "ImageUrl": "https://www.n9.be/media/event-large/2097-111580433schntzl.jpg",
    "Location": "muziekclub N9",
    "Description": ""
  }
]